"DESCRIPTION","DURATION IN MS","NAME","PARENT SUITE","START TIME","STATUS","STOP TIME","SUB SUITE","SUITE","TEST CLASS","TEST METHOD"
"","5491","should not log in with incorrect password","Playwright Windows 10","Sun Oct 12 19:10:52 UTC 2025","passed","Sun Oct 12 19:10:58 UTC 2025","User Authentication","Chrome 129.0.6668.29","",""
"","12748","should log in with valid credentials","Playwright Windows 10","Sun Oct 12 19:10:26 UTC 2025","passed","Sun Oct 12 19:10:39 UTC 2025","User Authentication","Chrome 129.0.6668.29","",""
"","3981","should not login with empty credentials","Playwright Windows 10","Sun Oct 12 19:10:58 UTC 2025","passed","Sun Oct 12 19:11:02 UTC 2025","User Authentication","Chrome 129.0.6668.29","",""
"","5241","should redirect to reset password page after clicking the Forgot password","Playwright Windows 10","Sun Oct 12 19:11:02 UTC 2025","passed","Sun Oct 12 19:11:07 UTC 2025","User Authentication","Chrome 129.0.6668.29","",""
"","5522","should not log in with incorrect email","Playwright Windows 10","Sun Oct 12 19:10:47 UTC 2025","passed","Sun Oct 12 19:10:52 UTC 2025","User Authentication","Chrome 129.0.6668.29","",""
